{
  "price": {
    "amount": "49.99",
    "currency": "EUR"
  },
  "type": "trip",
  "id": "SKJFHDUF123JKL",
  "passengers": [
    {
      "nationality": "US",
      "first_name": "Jason",
      "last_name": "Seagram",
      "gender": "male",
      "document_type": "passport",
      "type": "ADULT",
      "date_of_birth": "1999-02-25"
    },
    {
      "nationality": "GB",
      "first_name": "John",
      "last_name": "Doe",
      "gender": "male",
      "document_type": "passport",
      "type": "ADULT",
      "date_of_birth": "1994-02-14"
    },
    {
      "nationality": "PL",
      "first_name": "Janina",
      "last_name": "Kowalska",
      "gender": "female",
      "document_type": "ID",
      "type": "ADULT",
      "date_of_birth": "2001-02-28"
    }
  ],
  "itinerary": [
    {
      "from": {
        "country": "PL",
        "city": "Warsaw",
        "postal_code": "00-901",
        "street": "plac Defilad",
        "building": "1"
      },
      "to": {
        "country": "PL",
        "city": "Katowice",
        "postal_code": "40-005",
        "street": "al. Wojciecha Korfantego",
        "building": "35"
      },
      "id": "WARKAT000111222",
      "duration": "03:30",
      "distance": 305,
      "departure_datetime": "2022-03-10T08:30:00+02:00",
      "arrival_datetime": "2022-03-10T12:00:00+02:00"
    }
  ],
  "refund_policy": "fully refundable"
}
